{
  "schema_version": "dipole.agent.artifact-maintenance-authorization.v1",
  "mode": "dry_run",
  "action": "delete_candidate",
  "report_evidence_sha256": "1111111111111111111111111111111111111111111111111111111111111111",
  "bucket": "dipole-agent-artifacts",
  "prefix": "agent-artifacts/v1/",
  "object_key": "agent-artifacts/v1/dipole/task/2222222222222222222222222222222222222222222222222222222222222222/aaaaaaaaaaaaaaaaaaaaaaaaaaaaaaaaaaaaaaaaaaaaaaaaaaaaaaaaaaaaaaaa",
  "content_sha256": "aaaaaaaaaaaaaaaaaaaaaaaaaaaaaaaaaaaaaaaaaaaaaaaaaaaaaaaaaaaaaaaa",
  "size_bytes": 128,
  "etag": "etag-v1",
  "last_modified": "2026-08-25T10:00:00Z",
  "eligible_after": "2026-08-26T10:00:00Z",
  "candidate_observed_at": "2026-08-27T09:59:00Z",
  "proposal_id": "proposal-1",
  "proposer_id": "operator-1",
  "approver_ids": ["operator-2", "operator-3"],
  "executor_id": "operator-4",
  "maintenance_grant_version": "artifact-maintenance/v1",
  "generated_at": "2026-08-27T10:00:00Z",
  "expires_at": "2026-08-27T10:10:00Z",
  "metadata_recheck_required": true,
  "delete_adapter_available": false,
  "authorization_sha256": "e7735f3bfbb8703a450969d4e12a4a8ef6626b572e297f9f13e5ec901029cb33"
}
